"UUID","FILE","QUOTE_TRANSCRIPTION","ANCHOR","TYPE","URI","VOCAB_LABEL","VOCAB_TEMPORAL_BOUNDS","LAT","LNG","PLACE_TYPE","VERIFICATION_STATUS","TAGS","COMMENTS","GROUP_ID","GROUP_ORDER"
"088ba08e-2b00-49a8-a85e-dca8bb32ab73","1896-97aCLEAN.txt","Diese Ausstellung wurde von der englischen Bourgeoiste bereits im Jahre 1849, als noch der ganze Kontinent von Revolution träumte, mit der bewundernswerthesten Kaltblütigkeit ausgeschrieben. In ihr beruft sie ihre sämmtlichen Vasallen von Frankreich bis China zu einem großen Examen zusammen, auf dem sie nachweisen sollen, wie sie ihre Zeit ge¬ nutzt haben, und selbst der allmächtige Zar von Rußland kann nicht umhin, seinen Unterthauen zu befehlen, auf dieser großen Prüifung zahlreich zu erscheinen. Dieser große Weltkongreß von Produkten und Produzentet ist von ganz anderer Be¬ deulung als die absolutistischen Kongresse von Bregenz und Warschau, die unseren 3 Arbeiter und Gewerbeausstellung. koutinentalen Spießbürgern so viel Schweiß auspressen, oder als die europäisch¬ demokratischen Kongresse, welche die verschiedenen provisorischen Regierungen in partibus zur Rettung der Welt stets aufs Neue projektiren. Diese Ausstellung, ist ein schlagender Beweis von der konzentrirten Gewalt, womit die uoderne i¬ große Industrie überall die nationalen Schranken niederschlägt und die lokalen Besonderheiten in der Produktion, den gesellschaftlichen Verhältnissen, dem Cha¬ rakter jedes einzelnen Volkes, mehr und mehr verwischt. Indem sie die Gesammt¬ masse der Produktionskräfte der modernen Industrie auf einen kleinen Raum¬ zusammengedrängt zur Schau stellt, gerade zu einer Zeit, wo die modernen bürger¬ lichen Verhältnisse schon von allen Seiten untergraben sind, bringt sie zugleich, das Material zur Anschauung, das sich inmitten dieser unterwühlten Zustände für den Aufbau einer neuen Gesellschaft erzengt hat und noch täglich erzeugt. Die Bourgeoiste der Welt errichtet durch diese Ausstellung im modernen Rom¬ ihr Pantheon, worin sie die Götter, die sie sich selbst gemacht hat, mit stolzer Selbstzufriedenheit ausstellt. Sie beweist dadurch praktisch, daß die Ohumacht, und Verdrießlichkeit des Bürgers', von der deutsche Ideologen jahraus jahrein predigen, nur die eigene Ohnmacht dieser Herren ist, die moderne Bewegung zu begreifen, und ihre eigene Verdrießlichkeit über diese Ohnmacht. Die Bourgeoisie¬ feiert dies ihr größtes Fest in einem Augenblick, wo der Zusammenbruch ihrer ganzen Herrlichkeit bevorsteht, ein Zusammenbruch, der ihr schlagender als je nachweisen wird, wie die von ihr erschaffenen Mächte ihrer Zucht entwachsen sind. Bei einer zukünftigen Ausstellung werden die Bourgevis vielleicht nicht mehr als¬ Inhaber dieser Produktivkräfte, sondern nur noch als ihre Ciceroni figuriren.","char-offset:5695","","","","","","","","","Non_Kapital","Marx, Neuen Rheinischen Zeitung 1850","",""
"b17cf9ac-2dad-44dc-8850-66c30e32598d","1896-97aCLEAN.txt","London, 18. Oktober 1868. Werther Herr! Wenn Sie keine Antwort auf Ihren Brief vom 15. September erhielten, Ich verstand den Brief so, lag die Schuld an einem Mißverständniß meinerseits. daß Sie mir Ihre „Vorlagen“ zur Einsicht mittheilen wollten. Ich wartete darauf. 8 Die Neue Zeit. Dann kam Ihr Kongreß,! und nun hielt ich Antwort —(heing much overworked) — nicht mehr für dringend. Bevor Ihr Schreiben vom 8. Oktøber eintraf, hatte ich bereits wiederholt, in meiner Eigenschaft als Sekretär der Internationalen für Deutschland, zum Frieden gemahnt. Man hat mir geantwortet (und dazu Beleg¬ stellen aus dem „Sozialdemokrat“ geschickt), daß Sie selbst den Krieg provozirten. Ich erklärte, daß meine Rolle sich nothwendig auf die des „Unparteiischen“ beim Duell beschränken müsse. Ich glaube, das große Vertrauen, das Sie mir in Ihren Briefen aussprechen, nicht besser erwidern zu können, als indem ich Ihnen offen, ohne alle diplomatischen Umschweife, meine Ansicht über die Sachlage mittheile. Ich unterstelle dabei, daß es Ihnen wie mir nur um die Sache zu thun ist. Ich erkenne unbedingt die In¬ telligenz und Energie an, womit Sie in der Arbeiterbewegung wirken. Ich habe diese meine Ansicht keinem meiner Freunde verhehlt. Wo ich mich öffentlich auszu¬ sprechen habe — im Generalrath der Internationalen Arbeiterassoziation und dem habe ich, Sie beständig als einen Mann, hiesigen deutschen Kommunistenverein — unserer Partei behandelt und nie ein Wort über Differenzpunkte fallen lassen. Dennoch bestehen solche Differenzpunkte. D'abord, was den Lassalleschen Verein betrifft, so war er gestiftet in einer Zeit der Reaktion. Nach fünfzehnjährigem Schlummer rief Lassalle — und dies¬ bleibt sein unsterbliches Verdienst — die Arbeiterbewegung wieder wach in Deutsch¬ land. Aber er beging große Fehler. Er ließ sich zu sehr durch die unmittelbaren Zeitumstände beherrschen. Er machte den kleinen Ausgangspunkt - seinen Gegensatz¬ zum Zentralpunkt seiner Agitation — gegen einen Zwerg wie Schulze-Delitzsch Staatshilfe gegen Selbsthilfe. Er nahm damit nur die Parole wieder auf, die Buchez, der Chef des französischen katholischen Sozialismus, 1843 sgg. gegen die wirkliche Arbeiterbewegung in Frankreich ausgegeben hatte. Viel zu intelligent, um diese Parole für etwas anderes als ein transitorisches pis aller zu halten, konnte er ste nur durch ihre unmittelbare (angeblichel) prackieubility rechtfertigen. Zu diesem für die nächste Zukunft behaupten. Der Behufe mußte er ihre Ausführbarkeit „Staat"" verwandelte sich daher in den preußischen Staat. So wurde er zu Kon¬ zessionen an das pr. Königthum, die pr. Reaktion (Feudalpartei) und selbst die¬ Klerikalen gezwungen. Mit der Buchezschen Staatshilfe für Assoziationen verband er den Chartistenruf des allgemeinen Wahlrechts. Er übersah, daß die Bedingungen in Deutschland und England verschiedene. Er übersah die Lektionen des has empire über das allgemeine Wahlrecht. Er gab ferner von vornherein — wie jeder Mann, der behauptet, eine Panaeee für die Leiden der Masse in der Tasche zu haben — seiner Agitation einem religiösen Sektencharakter. In der That, jede Sekte ist religtös. Er verleugnete mit der früheren. ferner, eben weil Sektenstister, allen natürlichen Zusammenhang seiner Agitation nicht. Bewegung. Er fiel in den Fehler Proudhons, die reelle Basis¬ sondern letzterer nach. aus den wirklichen Elementen der Klassenbewegung zu suchen, einem gewissen doktrinären Rezept ihren Verlauf vorschreiben zu wollen. Was ich hier post Jestum sage, habe ich großentheils dem Lassalle vorher¬ gesagt, als er 1862 nach London kam und mich aufforderte, mich mit ihm an die Spitze der neuen Bewegung zu stellen. Sie selbst haben den Gegensatz zwischen Sektenbewegung und Klafsenbewegung, in eigener Person erfahren. Die Sekte sucht ihre raison d'étre in ihrem point¬ d'honneur, nicht in dem, was sie mit der Klassenbewegung gemein hat, sondern in dem besonderen Schiboleth, das sie von ihr unterscheidet. Als Sie daher zu Hamburg den Kongreß zur Trades Unions-Stiftung vorschlugen, konnten Sie den Sektenwiderstand nur niederschlagen durch Drohung, die Präsidentenwürde nieder¬ zulegen. Sie waren außerdent gezwungen, Ihre Person zu verdoppeln, zu erklären, ie das eine Mal als Sektenhaupt und das andere Mal als Organ der Klassenbewegung, zu handeln. D. h. die öffentliche Kongreßeinladung. 9 Ein Brief von Karl Marx an J. B. v. Schweitzer. Die Auflösung des A. D. A. gab Ihnen den (historischen)! Anlaß, einen großen Fortschritt zu vollziehen und zu erklären, zu beweisen, s'i le fallait, daß nun ein neues Entwicklungsstadium eingetreten und der Augenblick für die Sektenbewegung reif sei, in die Klassenbewegung aufzugehen und allem „Anerthum"" ein Ende zu machen. Was den wahren Inhalt der Sekte betraf, würde sie ihn, wie alle früheren Arbeitersekten, als bereicherndes Element in die allgemeine Bewegung tragen. Statt¬ bessen haben Sie in der That die Forderung an die Klassenbewegung gestellt, sich einer besonderen Sektenbewegung unterzuordnen. Ihre Nichtfreunde haben daraus, geschlossen, daß Sie unter allen Umständen Ihre „eigene Arbeiterbewegung“ konser¬ viren wollen. Was den Berliner Kongreß betrifft, so war d’abord die Zeit zicht drängend, da das Koalitionsgesetz noch nicht votirt ist. Sie mußten sich also mit den Führern, außerhalb des Lassalleschen Kreises verständigen, gemeinsamt mit ihnen den Plan¬ ausarbeiten und den Kongreß berufen. Statt dessen ließen Sie nur die Alternative, offen sich Ihnen anzuschließen, oder Front gegen Sie zu machen. Der Kongreß¬ selbst erschien nur als erweiterte Auflage des Hamburger Kongresses. Was den Statutenentwurf betrifft, so halte ich ihn für prinzipiell verfehlt, und ich glaube, so viel Erfahrung als irgend ein Zeitgenosse auf dem Gebiete der Trades Unions zu haben. Ohne hier weiter auf Details einzugehen, bemerke ich zur, daß die Organisation, so sehr sie für geheime Gesellschaften und Sektenbewegungen, taugt, dem Wesen der Trades Unions widerspricht. Wäre sie möglich - ich erkläre sie tout honnement für unmöglich —, so wäre sie nicht wünschenswerth, am wenigstett, in Deutschland. Hier, wo der Arbeiter von Kindesbeinen an bureaukratisch ge¬ maßregelt wird und an die Autorität, an die vorgesetzte Behörde glaubt, gilt es vor¬ allem ihn selbständig gehen zu lehren. Ihr Plan ist auch sonst unpraktisch. Im „Verband“ drei unabhängige Mächte verschiedenen Ursprungs: 1) der Ausschuß, gewählt von den Gewerken; 2) der Präsident (eine hier ganz überflüssige Person), gewählt durch allgemeines Stimm¬ recht. (In den Statuten der Internationalen Arbeiterassoziation figurirt auch ein Präsident der Assoziation. Er hatte jedoch in Wirklichkeit nie eine andere Funktion, als den Sitzungen des Generalraths zu präsidiren. Auf meinen Vorschlag schaffte man 1867 die Würde, die ich 1866 ausschlug, ganz ab und ersetzte sie durch einen Vorfitzenden (chiairman), der in jeder Wochensitzung des Generalraths gewählt wird. Der London Trades Council hat ebenfalls nur einen chairman. Sein stehendere, Beamter ist nur der Sekretär, weil dieser eine kontinuirliche Geschäftsfunktion verrichtet.) JNB. Dieser Passus folgt in der Abschrift des Briefes an Schweitzer nach¬ Beendigung des nächsten Satzes. D. H.) 3) Der Kongreß, gewählt durch die Lokali¬ täten. Also überall Kollisionen, und das soll „rasche Aktion“ befördern: Hier nun der Zwischensatz. D. H.) Lassalle beging großen Mißgriff, als er den „Au du suffruge universel“ der französtschen Konstitution von 1852 enklehnte. Nun gar in einer Trades Unionsbewegung! Diese dreht sich großentheils um Geldfragen, und Sie werden bald entdecken, daß hier alles Diktatorthum aufhört. Indeß, welches immer die Fehler der Organisation, sie können vielleicht durch rationelle Praxis mehr oder minder ausgemerzt werden. Ich bin bereit, als Sekretär der Internationale den Vermittler zwischen Ihnen und der Nürnberger Majorität, die sich direkt der Internationale angeschlossen hat, zu spielen — auf rationeller Grundlage, versteht sich. Ich habe dasselbe nach Leipzig geschrieben. Ich¬ verkenne die Schwierigkeiten Ihrer Stellung nicht und vergesse nie, daß Jeder von uns mehr von den Umständen als seinem Wollen abhängt. „Historisch“ ist im Original entweder unterstrichen oder durchstrichen. Wahrscheinlich letzteres. Das Manuskript ist hier sehr undeutlich. Kreuz- und Querstriche. Im Jahre 1868, wurde der bis dahin in Leipzig domizilirte Allgemeine Deutsche Arbeiterverein aufgelöst, worauf Schweitzer einen neuen Verein gleichen Namens und Charakters mit dem Zentralsitz Der Herausgeber. Berlin konstituirte. Die Neue Zeit. 10 Ich verspreche Ihnen unter allen Umständen die Unparteilichkeit sim Manu¬ fkript Unpartetischkeit. D. H.), die meine Pflicht ist. Anderseits kann ich aber nicht, versprechen, daß ich nicht eines Tages als Privatschriftsteller — sobald ich es für absolut durch das Interesse der Arbeiterbewegung diktirt halte — offene Kritik an dem¬ Lassalleschen Aberglauben üben werde, wie ich es seinerzeit an dem Proudhonschen gethan habe. Indem ich Sie perfönlich meines besten Willens für Sie versichere. Ihr ergebener K. Marx.","char-offset:24563","","","","","","","","","Non_Kapital","Marx letter 13th October 1868","",""
"268cb4b1-e25e-4c51-a3d0-aa51b85a298c","1896-97aCLEAN.txt","„die Arbeiter¬ klasse nicht die fertige Staatsmaschine einfach in Besitz nehmen und für ihre eigenen Zwecke in Bewegung setzen kann“","char-offset:91679","","","","","","","","","Manifest der Kommunistischen Partei","From German Forward 1872

","",""
"7acde8f4-49a6-4ec4-b03e-9a87498dfff2","1896-97aCLEAN.txt","Bet gewissem Höhegrad und Umfang der Waarenproduktion greift die Funktion des Geldes als Zahlungsmittel über die Sphäre der Waarenzirkulation hinaus. Es wird die allgeneine Waare der Kontrakte. Renten, Steuern u. s. w. ver¬ wandeln sich aus Naturallieferungen in Geldzahlungen. Wie sehr diese Um¬ wandlung durch die Gesammtgestalt des Produktionsprozefses bedingt wird, be¬ weist z. B. der zweimal gescheiterte Versuch des römischen Kaiserreichs, alle Ab¬ gaben in Geld zu erheben. Das ungeheure Elend des französischen Landvolts¬ unter Ludwig XIV., das Boisguillebert, Marschall Vauban u. s. w. so beredt denunziren, war nicht nur der Steuerhöhe geschuldet, sondern auch der Verwand¬ lung der Naturalsteuer in Geldsteuer. Wenn andererseits die Naturalform der Grundrente, in Asien zugleich das Hauptelement der Staatssteuer, dort auf Pro¬ duktionselementen beruht, welche sich mit der Umwandelbarkeit von Natural¬ verhältnissen reproduziren erhält jene Zahlungsform rückwirkend die alte Pro¬ duktionsform. Sie bildet eines der Selbsterhaltungsgeheimnisse des türkischen Reichs.“ („Kapital“, I. Band, 2. Auflage, Seite 122.)","char-offset:155397","","","","","","","","","Kapital","Band 1, 2. Auflage, p. 122","",""
"5000495a-aa4e-48ff-87df-4e8efd638a7d","1896-97aCLEAN.txt","Früher und mehr als andere seiner Landsleute hat sich Hyndman dem Studium des „Kapital“ ——— Wegen Raummangels verspätet. Die Redaktion. Ed. Bernstein: Sozialistische Oekonomie in England. gewidmet, und er hat keine Gelegenheit vorübergehen lassen, in Vorträgen und Abhandlungen die gewonnenen Ideen mit Schärfe geltend zu machen.","char-offset:167889","","","","","","","","","Kapital|Title Reference","","",""
"8acd38a9-948d-469a-a505-0a4856b977d0","1896-97aCLEAN.txt","dritten Band des „Kapital“","char-offset:176203","","","","","","","","","Kapital Bd. III","","",""
"5329896b-353d-46ac-9f2d-b5ed952cc8dc","1896-97aCLEAN.txt","Man vergleiche nur Hyndmans erthlehre mit dem fünften Kapitel des ersten Bandes: „Arbeitsprozeß und Verwerthungsprozeß"" wo der Leser Genaueres über die Werthbildung erfährt.","char-offset:179797","","","","","","","","","Kapital|Concept Reference","Chapter ""Arbeitsprozeß und Verwrthungsprozeß""","",""
"8d09bb68-efe2-4aa1-b47d-c581be70554c","1896-97aCLEAN.txt","Hyndman alle Probleme der Arbeitswerththeorte, die nicht im ersten Bande des „Kapital“ behandelt sind, dem Feilschen auf dem Markte“ zuschiebt, mit diesem die Sache für endgiltig erledigt hält.","char-offset:187419","","","","","","","","","Kapital|Title Reference","","",""
"6005b58c-9319-491e-98e5-90f0cc04ff4c","1896-97aCLEAN.txt","Wie wenig Marx dagegen selbst noch nach der Weiterausführung seiner Theorie im dritten Bande eine spezielle Analyse der Wirkungen von Bedarf und Zufuhr für überflüssig hielt, dafür nur eine Beweisstelle. „Die wirklichen inneren Gesetze der kapitalistischen Produktion"", schreibt er im zweiten Abschnitt des dritten Buches, „können offenbar nicht aus der Wechselwirkung von Nachfrage und Zufuhr. erklärt werden, da diese Gesetze nur dann rein verwirklicht erscheinen, sobald Nach¬ frage und Zufuhr aufhören zu wirken, d. h. sich decken.“ Aber er setzt in Klammern hinzu: „Ganz abgesehen von tieferer, hier nicht angebrachter, Analyse dieser beiden gesellschaftlichen Triebkräfte“ und bemer weiter, daß in der That Nachfrage und Zufuhr sich niemals decken, oder wenn sie es doch einmal thun, nur als Spiel des Zufalls, was wissenschaftlich gleich¬ Null zu setzen ist.","char-offset:187613","","","","","","","","","Kapital Bd. III","","",""
"c21763d0-9144-4125-9039-cff8d1544fc1","1896-97aCLEAN.txt","Die schönen Ausführungen des ersten Buches des „Kapital"" über die Waare und das Geld sind, wie man weiß, nicht nur begrifflich-analytischen, sondern auch genetischen Charakters, zeigen deren thatsächliche Entstehungs- und Entwicklungsgeschichte.","char-offset:188769","","","","","","","","","Kapital|Title Reference","","",""
"63aa481a-5e9c-4398-88da-83447fd1d6cd","1896-97aCLEAN.txt","„Welches immer die spezifische Form. schreibt Marx, „alle Typen derselben haben das gemein, daß der Rente sei"", die Aneignung der Rente die ökonomische Form ist, worin sich das Grundelgenthum realisirt, und daß ihrerseits die Grundrente ein Grund¬ eigenthum, Eigenthum bestimmter Individuen an bestimmten Stücken des Erd¬ balls voraussetzt, sei es ... ein Verhältniß zum Boden, welches, wie bei Kolonisten und kleinbäuerlichen Grundbesitzern, bei der isolirten und nicht sozial entwickelten Arbeit eingeschlossen scheint in der Aneignung und Produktion der Produkte bestimmter Bodenstücke durch die unmittelbaren Produzenten“ („Kapital“, III, 2. Theil, S. 174).","char-offset:191681","","","","","","","","","Kapital Bd. III","","",""
"4e99f6c3-2797-4723-80e0-c62532063a80","1896-97aCLEAN.txt","Schließlich hätte Hyndman unseres Erachtens gut gethan, seine Bemer¬ kungen über die Entwicklung von der kapitalistischen zur sozialistischen Gesellschafts¬ ordnung hinsichtlich der Frage friedlich oder gewaltthätig etwas mehr im Sinne¬ des Vorworts zum „Kapital"" zu halten.","char-offset:192481","","","","","","","","","Kapital|Title Reference","","",""
"569faf80-bb4e-4227-9a2d-1e75d66cda2f","1896-97aCLEAN.txt","„Ohne Parteien keine Entwicklung, ohne Scheidung kein Fortschritt.“ (Aus dem Leitartikel der „Rheinischen Zeitung“, 1842. Nr. 179).","char-offset:248282","","","","","","","","","Non_Kapital","Rheinische Zeitung 1842","",""
"1cf8b22b-cc2b-4947-87fd-a44242b58a90","1896-97aCLEAN.txt","Erstens gehört der wahre Sozialismus, Struve: Zur Entwicklungsgeschichte des wissenschaftlichen Sozialismus. 69 von Heß, Grün und Anderen ganz der Geschichte an und wir brauchen deshalb","char-offset:248746","","","","","","","","","Manifest der Kommunistischen Partei|Concept Reference","Wahre Socialismus","",""
"ac9e741a-8dd9-46c0-b45e-6841c874dcf1","1896-97aCLEAN.txt","Zweitens hatten Marx und Engels einen ganz besonderen Rechtstitel auf scharfes, absprechendes Auftreten gegen den „wahren Sozialismus“: sie waren, selbst in gewissem Sinne „wahre Sozialisten“ gewesen.","char-offset:249553","","","","","","","","","Manifest der Kommunistischen Partei|Concept Reference","Wahre Socialismus","",""
"0c08c222-6b91-41bb-8c4a-498b28931e22","1896-97aCLEAN.txt","„Also weder Materialist, noch Idealist, noch Identitätsphilosoph ist Feuerbach. Nun, was denn? Er ist mit Gedanken, was er der That nach, im Geiste, was er im Fleische, im Wesen, was er in den Sinnett ist — Mensch; oder vielmehr, da Feuerbach nur in die Gemeinschaft das Wesen des Menschen versetzt: Gemeinmensch, Kommunist“","char-offset:251601","","","","","","","","","Non_Kapital","","",""
"760adf37-c514-4579-9192-5e8e7ef07cd2","1896-97aCLEAN.txt","Dieser Aufsatz ist zuerst anonym in der Wigandtschen Vierteljahrsschrift 1845 erschienen). Noch weiter geht Feuerbach in dieser Richtung in dem Aufsatz: „Die Naturwissenschaft und die Revolution""","char-offset:251944","","","","","","","","","Non_Kapital","","",""
"0354fa60-589b-45d1-a66d-0e7b3b8de52e","1896-97aCLEAN.txt","Deshalb — glaube ich - hat man oft die ersten Schriften Beider — und besonders Marx' —, die Aufsätze in den „Deutsch-französischen Jahrbüchern"" und die „Heilige Familie“ ohne Weiteres.","char-offset:253201","","","","","","","","","Non_Kapital|Title Reference","","",""
"661e7279-e09d-4d40-93a2-4b139e9dcb17","1896-97aCLEAN.txt",". Kampffmeyers Darstellung wird gar nicht dem, wirklichen geschichtlichen Entwicklungsgange der Ideen gerecht. Auf den Brief von Marx und Ruge aus dem Jahre 1843 (datirt Kreuznach, September 1843, also aus der Zeit vor dem Pariser Aufenthalt stammend, f. „Deutsch-französische ihrbücher"" S. 35—40) sich berufend, behauptet Kampffmeyer: „Schon 1843, hatte der kritische Geist von Karl Marx den utopistischen Sozialismus über¬ wunden.","char-offset:253721","","","","","","","","","Non_Kapital|Title Reference","","",""
"ac4c2274-c167-4006-af62-3e463dce0a0d","1896-97aCLEAN.txt","Erst in Paris ist Marx Sozialist geworden, erst hier und in Brüssel hat er die in der „Misére de la philosophie“ niedergelegten Kenntnisse erworben und die sozialistischer Literatur kritisch zum wissenschaftlichen Sozialismus verarbeitet.","char-offset:254900","","","","","","","","","Non_Kapital|Title Reference","","",""
"ea1cb636-5e12-4b48-b4e8-26339280f9ff","1896-97aCLEAN.txt","Dr. Wenckstern hat zu seinem Unglück die „Deutsch¬ französischen Jahrbücher"" und die „Heilige Famtlie“ gelesen; diese Lektüre hat¬ ihn zu allerhand Gegenüberstellungen verleitet, die — um seinen eigenen Ausdruck, zu gebrauchen — nur „ein müssiges"" und — fügen wir selbst hinzu — entsetzlich „Bemerkungen über die neueste preußische Zensurinstruktion von einem Rheinländer“, S. 56—88 von Band I der „Anekdota zur neuesten deutschen Philosophie und Publizistik"", herausgegeben von Arnold Ruge, Zürich und Winterthur 1843; darüber, daß dieser Aufsatz¬ Marx gehört, läßt sein Stil keine Zweifel zu. Uebrigens nennt Ruge in seinem Briefe, vom 3. September 1842 an Julius Fröbel, den Verleger der „Anekdota“, Marx als den Verfasser der Bemerkungen. S. Ruges Briefwechsel, Band I S. 279. * Ich bemerke noch, daß die nationalökonomischen Ausführungen Engels' aus dem Jahre 1844 („Umrisse"" in den Deutsch-französischen Jahrbüchern) und Marx aus dem Jahre 1845 („Heilige Familie"") noch stark utopistisch sind. Ueber die Unverständlichkeit von Heß klagt der „Pariser Korrespondent“ von Weit¬ ling (s. „Die Kommunisten in der Schweiz"", Zürich 1843, S. 83—84) und spottet Ruge (im oben zitirten ersten Briefe gegen den Kommunismus).","char-offset:259334","","","","","","","","","Non_Kapital|Title Reference","","",""
"74e97858-6648-4e81-a6d8-ae40602359dc","1896-97aCLEAN.txt","Er wird von Herrn Wenckstern mit dem „kapitalistischen Egoisten“ des „Kapitals“ in Parallele gestellt.","char-offset:261010","","","","","","","","","Kapital|Title Reference","","",""
"458c4bb1-28d3-4bb5-be07-f695718d8ae7","1896-97aCLEAN.txt","„Der wirkliche Gattungsmensch' von Marx ist das Gebilde eines über alle Maßen leichtsinnig konstruirenden Kopfes, ein Phantom auf dem Gebiete der Sittlichkeit, wie die abstrakt menschliche Arbeit auf dem Gebiete der Wirth¬ chaft“","char-offset:261264","","","","","","","","","Non_Kapital","","",""
"ee5f078f-64ff-4dcb-8928-18dd9c314a70","1896-97aCLEAN.txt","selbst nur eine aparte, von seinem Gegensatz, dem Privatwesen, entfernte Erscheinung des humanistischen Prinzips.“ „Und das ganze sozia¬ listische Prinzip ist wieder nur die eine Seite, welche die Realität des wahren¬ menschlichen Wesens betrifft","char-offset:262630","","","","","","","","","Non_Kapital","","",""
"109cfc36-8305-4b6b-9c4d-37a6f194f149","1896-97aCLEAN.txt","Christlich ist die politische Demokratie, indem in ihr der Mensch, nicht nur ein Meusch, sondern jeder Mensch, als souveränes, als höchstes Wesen gilt, aber der Mensch in seiner unkultivirten, unsozialen“ Erscheinung, der Mensch¬ in seiner zufälligen Existenz, der Mensch, wie er geht und steht, der Mensch, wie er durch die ganze Organisation unserer Gesellschaft verdorben, sich selbst¬ verloren veräußert, unter die Herrschaft unmenschlicher Verhältnisse und Elemente¬ gegeben ist, mit einem Worte, der Mensch, der noch kein wirkliches Gattungswesen","char-offset:262897","","","","","","","","","Non_Kapital","","",""
"77880b02-d5c0-4686-b2b2-335cca72b9bc","1896-97aCLEAN.txt","Erst wenn der wirk¬ liche individuelle Mensch den abstrakten Staatsbürger in sich zurücknimmt und als individueller Mensch in seinem empirischen Leben, in seiner individuellen Arbeit,","char-offset:263554","","","","","","","","","Non_Kapital","","",""
"cc500f1c-66ba-4ea2-b9ac-7426af676e6c","1896-97aCLEAN.txt","Die Veräußerung ist die Praxis der Entäußerung. Wie der Mensch, seo¬ lange er religiös befangen ist, sein Wesen nur zu vergegenständlichen weiß, indem er es zu einent freinden, phantastischen Wesen macht, so kann er sich unter der Herrschaft des egoistischen Bedürfnisses nur praktisch bethätigen, nur praktisch, Gegenstände erzeugen, indem er seine Produkte wie seine Thätigkeit unter die Herrschaft eines fremden Wesens stellt und ihnen die Bedeutung eines freinden Wesens — des Geldes — berleiht","char-offset:264464","","","","","","","","","Non_Kapital","","",""
"163de9f8-0854-4e3b-b998-e8cd557dc503","1896-97aCLEAN.txt","der reale Humanismus","char-offset:265549","","","","","","","","","Non_Kapital","","",""
