"UUID","FILE","QUOTE_TRANSCRIPTION","ANCHOR","TYPE","URI","VOCAB_LABEL","VOCAB_TEMPORAL_BOUNDS","LAT","LNG","PLACE_TYPE","VERIFICATION_STATUS","TAGS","COMMENTS","GROUP_ID","GROUP_ORDER"
"2469c6aa-a56b-4172-a7a5-6f7da298a196","1896-97aCLEAN.txt","„Es ist jedesmal das unmittelbare Verhältniß der Eigenthümer der Produktions¬ bedingungen zu den wirklichen Produzenten — ein Verhältniß, dessen jedesmalige, Form stets naturgemäß einer bestimmten Entwicklungsstufe der Art und Weise, K. Kautsky: Utopistischer und materialistischer Marxismus. 717 der Arbeit und daher ihrer gesellschaftlichen Produktivkraft entspricht —, worin wir das innerste Geheimniß, die verborgene Grundlage der ganzen ge¬ sellschaftlichen Konstruktion und daher auch der politischen Form des Souveränitäts¬ und Abhängigkeitsverhältnisses, kurz der jedesmaligen spezifischen Staatsform¬ finden. Dies hindert nicht, daß dieselbe ökonomische Basis — dieselbe den Haupt¬ bedingungen nach — durch zahllose empirische Umstände, Naturbedingungen, Rassen¬ rhältnisfe, von außen wirkende geschichtliche Einflüsse u. s. w. unendliche Varia¬ tionen urid Abstufungen zeigen kann, die nur durch Analyse dieser empirische gegebenen Umstände zu begreifen sind.“","char-offset:2644793","","","","","","","","","Kapital Bd. III","pp.766-767","",""
"a4070efb-3957-4279-bbeb-e79834ecafae","1896-97aCLEAN.txt","Wie dessen Puritanismus sich sagenden“ von Generation zu Generation mit der Entwicklung der Industrie modifizirt, zeigt, U. A. die Schrift des Dr. Aitken, die Marx im 22. Kapitel des 1. Bandes des¬ zitirt. Kurz, der Puritanismus Englands tritt uns entgegen als historische „Kapital“ Erscheinung, die das öffentliche Leben in dem Maße beherrscht, als bestimmte lassen, deren Existenzbedingungen er entspricht, demselben ihren Stempel auf¬ zudrüicken vermögen.","char-offset:2679210","","","","","","","","","Kapital|Title Reference","Non-quoted, passing reference to Ch.22","",""
"ed96e882-60b9-4a40-8ca9-73b2313f807e","1896-97aCLEAN.txt","So wurde das „Kapital"" uns er¬ völlig erschlossen durch die Polemik gegen Dühring und die Neuveröffentlichung der fast verschollenen Polemik gegen Proudhon. Die Anschauungen des „Kom¬ munistischen Manifests"" und des „Kapital"" sind jetzt in der sozialistischen Be¬ wegung allenthalben anerkannt, aber die alte utopistische Denkweise ist zu nahe¬ liegend und zu mächtig, als daß sie nicht immer wieder sich unbewußt geltend, machte.","char-offset:2683079","","","","","","","","","Kapital|Manifest der Kommunistischen Partei|Title Reference","","",""
"995672e1-0ace-4394-b652-6adca2af2528","1896-97aCLEAN.txt","Es fängt auch im ärztlichen Stande an, sich eine Reservearmee zu bilden, bereit, zu jædem Preise und Die Neue Zeit. 728. unter allen Bedingungen ihre Arbeitskraft zu verwerthen.","char-offset:2685645","","","","","","","","","Kapital|Concept Reference","Reservearmee","",""
"ea46f0b6-d897-4e8e-99cb-b06164e94da2","1896-97aCLEAN.txt","Ist irgendwor eine Lohnstreitigkeit oder dergleichen zum Ausbruch gekommen, so finden sich leicht aus der Reservearmee am Orte oder von auswärts Ersatzmänner.","char-offset:2689485","","","","","","","","","Kapital|Concept Reference","Reservearmee","",""
"a30872c3-3229-407c-9377-16f3061d0841","1896-97aCLEAN.txt","Auf sehr vielen Gütern ist so gut wie gar kein Personenwechsel int den Reihen der Pächter eingetreten. Die kapitalistischen Pächter sind den Landlords gegenüber die Herren der Situation. Einst waren lange Pachtverträge das Schutzmittel der Pächter gegen habgierige Landlords, noch Marx spricht im „Kapital"" III, 2, S. 213, von ihnen in diesem Sinne, heute aber wollen gerade die Pächter nur noch kurze Pachten eingehen (König, S. 63, 108 rc.).","char-offset:2874746","","","","","","","","","Kapital Bd. III","p.213","",""
