file,sent_idx,char_idx,sentence,phrases,lem_phrases
1897-98aCLEAN,20880,2957072,"Sie hat
gleichzeitig zur Hebung des Proletariats das Kapital zu bekämpfen und zur
Wahrung des ökonomischen Fortschritts die Grundlagen der kapitalistischen Pro¬
duktion gegen den Ansturm der Reaktion zu vertheidigen;",Kapital | Das Kapital,kapital | der kapital
1897-98aCLEAN,20885,2957719,"Daß das industrielle Kapital bei dieser
Politik auch seinen Vortheil haben wollte, ist richtig, aber es bildet nicht die
Triebkraft der kolonialen Bewegung.",Kapital,kapital
1897-98aCLEAN,20889,2958595,"Die Menge des jährlich akkumulirten Mehrwerths ist so gewaltig, daß in
den meisten kapitalistischen Staaten die Bedürfnisse der Industrie, des Handels,
des Staates und der Kommunen trotz ihres steten Wachsthums nicht mehr genügen,
dem wachsenden Kapital gute Anlagemöglichkeit zu geben.",Kapital,kapital
1897-98aCLEAN,21063,2981636,"Professor Dietzel muß die ganze Geschichte der Gewerk¬
vereine, nicht nur der englischen Gewerkverein, fälschen — nein, er muß sie
verschwinden lassen, unter unseren Händen und vor unseren Augen in dem trüben
Dunste der Interessenharmonie zwischen Kapital und Arbeit in Rauch aufgehen
lassen.",Kapital,kapital
1897-98aCLEAN,21064,2981929,"Nur wo das Koalitionswesen noch in den Kinderschuhen steckt, kann man,
so behauptet unser Professor, jeden Strike als eine Schlacht der „Arbeit“ gegen
das „Kapital“ darstellen.",Kapital | Das Kapital,kapital | der kapital
1897-98aCLEAN,21066,2982267,"Die Striks sind keine Schlachten der Arbeit
gegen das Kapital.",Kapital | Das Kapital,kapital | der kapital
1897-98aCLEAN,21069,2982625,Kapital zu führen.,Kapital,kapital
1900-01a,220,35167,"So sind die Agrarier
allenthalben die wüthendsten Gegner des Arbeiterschutzes geworden; sie, unter¬
stützen nicht nur das industrielle Kapital in seiner Abwehr des Arbeiterschutzes,
sondern suchen seine Feindseligkeit dagegen womöglich noch zu verstärken.",Kapital,kapital
1900-01a,229,36982,"Wenn der Arbeiter für den gesetzlichen Arbeiterschutz, vor Allem für den
Normalarbeitstag eintritt, so leitet ihn dabei nicht allein das hygienische Be¬
dürfniß, sondern auch das Kulturbedürfniß und der Gegensatz gegen das Kapital.",Kapital | Das Kapital,kapital | der kapital
1900-01a,232,37479,"Dazu kommt, daß das Kapital die Arbeit jedes Inhalts und jedes Reizes¬
für den Lohnarbeiter beraubt.",Kapital | Das Kapital,kapital | der kapital
1900-01a,1923,289472,"Nun, als Karl Marx sein „Kapital“
schrieb, konnte er mit vollem Rechte annehmen, daß auch in der Landwirthschaft
eine Konzentration der Betriebe stattfinden werde;",Kapital,kapital
1900-01a,1963,296247,"Mit dem einen Pferde, das auch keine zu große Kapitals¬
anlage repräsentiren darf, kann der Acker nur nothdürftig durchgearbeitet werden.",Kapital,kapital
1900-01a,2098,312360,"Im ersten Bande des „Kapital"" macht Marx im Anschluß an Robert Owen¬
gelegentlich die bedeutsame Bemerkung, daß die Erzlehung in der künftigen Gesell¬
schaft für alle Kinder, die ein gewisses Alter überschritten haben, produktive
Arbeit mit Unterricht und Gymnastik verbinden werde, nicht nur als eine
Methode zur Steigerung der gesellschaftlichen Produktion, sondern als die einzige
Methode zur Produktion vollständig entwickelter Menschen.",Kapital | Das Kapital,kapital | der kapital
1900-01a,2953,429981,"Das kaufmännische Kapital verfehlte nicht, die Liquidation der Guts¬
rrschaft und den Niedergang der Bauernwirthschaft in Rußland sich zu Nutze.",Kapital,kapital
1900-01a,3044,440613,"Welche Chancen eröffnet denn der
ruinirte Bauer dem Kapital?",Kapital | Das Kapital,kapital | der kapital
1900-01a,3455,488095,"Oder gart „Die stündlich steigenden Arbeiter¬
löhne, einhergehend mit stetig sinkender Leistung, läßt dem Unternehmungs¬
kapital keine entsprechende Verzinfung zukommen.“",Kapital,kapital
1900-01a,3687,508961,"Zum Beispiel haben die
Salvarywerke in Bernburg, denen auch Kohlengruben eignen, bei einem Aktien¬
kapital von 10 Millionen Mark ihre Reservefonds mit über 23 Millionen Mark¬
dotirt!",Kapital,kapital
1900-01a,4546,623155,"„Die Anlage eines gewissen Kapitals in derartigen Baustellen hat eine gewisse¬
Aehnlichkeit mit Sparkasseneinlagen, wovon man nicht jährlich Zinsen erhebt, sondern,
die Zinsen ruhig dem Kapital zuwachsen laßt und dann nach Jahren durch das An¬
wachsen überrascht worden ist.",Kapital | Das Kapital,kapital | der kapital
1900-01a,4557,625694,"Derjenige, der einen solchen Bau¬
platz besitzt, riskirt jetzt die Zinfen des Kapitals, welches er für den Bauplatz her¬
gegeben hat.",Kapital | Das Kapital,kapital | der kapital
1900-01a,4637,636884,"Die Verstaatlichung der Kohlengruben heißt also nichts Anderes, als
daß der Staat an deren Besitzer ein Kapital zahlt (oder es ihnen schuldig bleibt,
und verzinst), dessen Zinsen gleich sind dem Betrag, den die Kohlenmagnaten durch
ihren Wucher den Arbeitern und den Konsumenten im Jahre erpressen, oder viel¬
mehr erpressen können, denn die mögliche oder wahrscheinliche Steigerung der
Grundrente kommt mit in dem Preise von Grund und Boden oder Bergwerken in
Betracht.",Kapital,kapital
1900-01a,4643,637934,"Aber zu der Forderung einer Konfiskation des Eigenthums am
den Bergwerken kannt er sich doch nicht entschließen, und so macht er den Vermitt¬
lungsvorschlag, die Bergwerke sollten abgelöst werden gegen Rückzahlung der in
ihnen investirten, noch nicht amortisirten Kapitalien, inbegriffen den Ankaufs¬
preis der Bergwerke.",Kapital,kapital
1900-01a,4703,646964,"Sind wir aber einmal so weit, daß wir eine Regierung haben, die gegen das
Kapital solche Mittel anwendet, dann können wir es getrost darauf ankommen lassen, i
daß sie über sich selbst hinaus zur Verstaatlichung treiben, denn dann können wir¬
überzeugt sein, daß diese politisch wie ökonomisch unter Bedingungen vor sich geht,
die dem Proletariat wie der gesammten Gesellschaft zum Vortheil gereichen.",Kapital | Das Kapital,kapital | der kapital
1900-01a,4728,650940,"Man diskutirt mitunter die Frage, ob wir das Kapital konfisziren oder ablösen,
sollen.",Kapital | Das Kapital,kapital | der kapital
1900-01a,6581,906392,"An diesem Zwischenspiel waren nahezu anderthalb Hunderttausend Arbeits¬
männer nebst ihrett erwachsenen und halberwachsenen Angehörigen betheiligt l
aktiv betheiligt, und noch niemals hat ein direkter Kampf zwischen Arbeit und
Kapital, ein Kanipf von solchem Umfang und so tief erregendem, dramatischem
Verlauf in so kurzer Frist vor dem Wahltag stattgefunden.",Kapital,kapital
1900-01a,7101,964337,"Gezwungen durch die Kohlenkalamität wird
sich das englische Kapital zweifel¬
los intensiv an die Ausbeutung der Kohlenadern in den Kolonien machen, den ,
in abfehbarer Zeit kann das Mutterland nicht mehr der Brennstoffe Gebende, sondern
muß der Nehmende sein.",Kapital,kapital
1900-01a,8274,1096191,"Und ich glaube, es wäre auch
schwer, ein anderes vorzubringen, angesichts der Thatsache, daß die Festsetzung der
Preise der Bergwerksprodukte durch die Staatsgewalt nichts Unerhörtes ist, sondernn
seit Jahrhunderten bestand und erst im Laufe des neunzehnten Jahrhunderts unter¬
dem wachsenden Drucke des gegen die staatliche Oberhoheit rebellirenden Kapitals,
beseitigt wurde.",Kapital,kapital
1900-01a,8345,1107255,"Dort finden wir folgende Tabelle:
Dividende bezw. Ausbeute Abschreibungen,
Reservefonds
Proz. des Kapitals.",Kapital | Das Kapital,kapital | der kapital
1900-01a,8346,1107363,"Proz. des Kapitals Proz. des Kapitals
1873.",Kapital | Das Kapital,kapital | der kapital
1900-01a,8359,1107784,"Effertz bemerkt dazu:
„Die bemerkenswerthen Resultate dieser Tabelle sind folgende:
„1. eine durchschnittliche Verzinsung des Kapitals (NB. unter Einbeziehung der
fetten“ Jahre 1873, 1874 und 18901) von 4,55 Prozent;",Kapital | Das Kapital,kapital | der kapital
1900-01a,8360,1108001,"„2. eine durchschnittliche Abschreibung auf das Kapital ausgerechnet (NB. immer¬
einschließlich der fetten Jahre 1873, 1874 und 1890) von 1,6 Prozent;",Kapital | Das Kapital,kapital | der kapital
1900-01a,8361,1108152,"„S. eine durchschnittliche Rücklage zu Reserve- und anderen Fonds auf das
Kapital ausgerechnet von 0,7 Prozent.",Kapital | Das Kapital,kapital | der kapital
1900-01a,8362,1108264,"Ist man geneigt, eine Abschreibung von 3 Prozent vom Kapital für den
Bergbau im Durchschnitt nicht zu hoch zu finden, so würde sich die Verzinsung des
Kapitals auf 3,15 Prozent reduziren, und ist man ferner geneigt, zuzugestehen, daß ien
die Rücklagen mit 1 Prozent nicht zu hoch gegriffen sein würden, so würde sich
das jämmerliche Resultat von 2,85 Prozent ergeben.",Kapital | Das Kapital,kapital | der kapital
1900-01a,8445,1118903,"noch ist er reich genug,
aber bald wird das künstlerische Kapital aufgezehrt sein.",Kapital,kapital
1900-01a,9027,1188164,"Das Kapital wird nicht wie in Europa sich unheimlich fühlen, es wird sich frei¬
entfalten können.",Kapital | Das Kapital,kapital | der kapital
1900-01a,10225,1352812,"Es ist fast gar nichts Bedeutendes, kein Kapital,
von Karl Marx, kein Buckle oder etwas Aehnliches, kein Byron oder Mickiewicz,
in den Jargon übersetzt, die Jargonliteratur hat auch wenig Tiefes an originalen
Arbeiten hervorgebracht.",Kapital,kapital
1900-01a,10376,1376237,"Und nach einer längeren Besprechung des kläglichen Zustandes, in dem sich die
Landwirthschaft in Italien befindet — theils durch die Nachläfsigkeit der Regierung,
theils dadurch, daß die Kapitalisten die industrielle Verwendung ihres Kapitals vor
der landwirthschaftlichen bevorzugen, wodurch sie allerdings ihr privates Interesse,
in Gegensatz zu dem der Allgemeinheit bringen, welche die höchste Produktivität des
Bodens verlangen müßte —, erörtert der Autor die Frage nach dem Einfluß des
neuen technischen produktiven Apparats auf die verschiedenen Formen des Grund¬
besitzes.",Kapital,kapital
1900-01a,10378,1377085,"Der landwirthschaftliche Großbetrieb kann, da er über große Kapitalien verfügt,
die vom Grundbesitzer, vom Pächter oder von den Aktionären stammen, sich in
großem Stile der technischen Hilfsmittel bedienen und die Produktion vermehren.",Kapital,kapital
1900-01a,10379,1377321,"Aber wird denn nun der mittlere und Kleinbetrieb, der nur über sehr geringes,
manchmal über gar kein Kapital verfügt, dazu bestimmt sein, im Wettbewerb mit
dem Großgrundbesitz, mit dem Großbetrieb, zu unterliegen?",Kapital,kapital
1900-01a,10922,1467090,"Die Besitzer sind dann Großkaufleute, höhere Beamte &c.,
die ihr „erspartes“ Kapital in Grundbesitz anlegen, theils auch Adelige, die aus dem,
einen oder anderen Grunde ihre Güter verpachten.",Kapital,kapital
1900-01a,10923,1467282,"Daß dieses System der Konzen¬
tration des Kapitals auch auf dem Gebiet der Landwirthschaft bedeutenden Vorschub¬
leistet, liegt auf der Hand.",Kapital | Das Kapital,kapital | der kapital
1900-01a,11065,1480853,"Das industrielle und kommerzielle Kapital könnte die Bedingungen,
zur Entfaltung der Großindustrie in Frankreich nur schaffen durch die politische
Stärkung des Proletariats.",Kapital,kapital
1900-01a,11079,1482330,"Die Ursache dieser Erscheinung ist darin zu suchen, daß rascher als der Welt¬
markt die Zahl der Konkurrenten auf dem Weltmarkt wächst, da jedes der Länder,
die ihm eröffnet werden, sich bestreben muß, eine kapitalistische Industrie zu ent¬
wickeln — wobei die Kapitalisten der alten Industrieländer nach Kräften nachhelfen,
indem sie ihre neuakkumulirten Kapitalien in jungen Ländern anlegen.",Kapital,kapital
1900-01a,12071,1619668,"Die Grundzinsensteuer soll den
ganzen Bodenertrag, welcher lediglich dem reinen Wirken der Vegetationskräfte und
nicht dem Kapital oder der Arbeit zu verdanken ist, zu Gunsten der Gemeinschaft,
fortnehmen.",Kapital | Das Kapital,kapital | der kapital
1900-01a,12653,1687510,"Wie ist es da möglich, daß die Gewerkschaften und Hilfskassen, welche so¬
harte Kämpfe führen müssen, noch Kapitalien ansammeln, um große Verkaufsläden
zu errichten, weitläufige Verfammlungs- und Festsäle, kurz um das Werk der wirth¬
schaftlichen Organisation und fozialistischen Erziehung der Arbeiterklasse zu fördern.",Kapital,kapital
1900-01a,12662,1688567,"ihren Frauen Vortheile zu, das heißt der anderen Hälfte der Arbeiterklasse, und
zwar der rückständigsten Hälfte derselben, dem Theile des Proletariats, der noch and
meisten der Macht des Priesters und des Kapitals unterworfen ist.",Kapital | Das Kapital,kapital | der kapital
1900-01a,13045,1731592,"Sich der Ausbeutung und Unterdrückung durch das Kapital zu wider¬
setzen, auf die Vernichtung des Kapitalverhältnisses hinzuarbeiten, wird nicht nuri
durch das Sonderinteresse des Proletariats, sondern durch das Gesammtinteresse der
Gesellschaft geboten.",Kapital | Das Kapital,kapital | der kapital
1900-01a,13102,1739031,"so hat der Unter¬
nehmer die Pflicht, Unternehmungen zu leiten, der Bodenbesitzer die, den Boden
bebauen zu lassen, der Kapitalist.
jene, ohne Wucher sein Kapital in Funktion zu
setzen, der Arbeiter endlich aber hat die hohe sittliche Pflicht — zu arbeiten.",Kapital,kapital
1900-01a,13348,1776990,"483
Ein nationalsozialer Weiser deutet an, die Sozialdemokratie führe den Kampf¬
gegen den Brotwucher so lässig, weil sie aus der Auspowerung der Volksmassen¬
parteitaktisches Kapital zu schlagen beabsichtige.",Kapital,kapital
1900-01a,13701,1821989,"Das Kapital hat in der Kunst wie in der Produktion zerstört, aufgelöst,
und die Quadersteine des künftigen Baues in unordentlichen Haufen zusammen¬
gebracht — der architektonische Aufbau bleibt dem Soztalismus vorbehalten.",Kapital | Das Kapital,kapital | der kapital
1900-01a,15585,2100618,"Hier be¬
deutet das Eindringen der Elektrotechnik in die Landwirthschaft einen erheblichen
Schritt weiter in ihrer Unterwerfung unter das Kapital.",Kapital | Das Kapital,kapital | der kapital
1900-01a,15592,2101729,"Unter günstigen Verhältnissen können vielleicht Großgrund¬
besitzer oder Großbauern die nöthigen Kapitalien auftreiben, um ein Elektrizitätswerken
genossenschaftlich zu errichten und zu betreiben.",Kapital,kapital
1900-01a,15624,2107179,"Wenn in dieser Zeit, wie in den Nächten, ein
so theures Kapital fast unverzinst bleiben sollte, würde die abgebbare Kraft zu theuer
und das Unternehmen unrentabel werden;",Kapital,kapital
1900-01a,15641,2110533,"Aber wir haben schon bemerkt, daß sie den Landwirth mit vermehrter Abhängig¬
keit vom Kapital und steigender Ueberflüssigkeit in seinem Produktionsprozeß bedroht.",Kapital | Das Kapital,kapital | der kapital
1900-01a,15859,2145822,"Die klassische, also englische politische Oekonomie war die Wortführerin.
des Kapitals, das seine nationalen Schranken sprengte und einen Weltmarkt,
schuf.",Kapital | Das Kapital,kapital | der kapital
1900-01a,15890,2151356,"Wo die Anderen nur einen Geist und eine Seele sahen, den Geist und die Seele¬
des profitbildenden Kapitals, deckte er einen durch Kreuz und Quer gehenden
Widerstreit der Interessen des Industriellen, des Grundbesitzers, des Pächters,
des kleinstädtischen Handwerkers, des Landarbeiters, des Fabrikarbeiters alf.",Kapital,kapital
1900-01a,15920,2156647,"Engels zitirt Marx' „Kapital"" (ich
vervollständige das Zitat): „Das Protektionsfystem war ein Kunstmittel, Fabri¬
kanten zu fabriztren, unabhängige Arbeiter zu expropriiren, die nationalen Pro¬
duktions- und Lebensmittel zu kapitalisiren, den Uebergang aus der alterthüm¬
lichen in die moderne Produktionsweise gewaltsam abzukürzen.",Kapital,kapital
1900-01a,15925,2157452,"dem
ursprüngliche Kapital der Industriellen fließt hier zum Theil direkt aus¬
Staatsschatz.",Kapital,kapital
1900-01a,15929,2157908,"Das Industrie¬
kapital Englands hat sich
den Freihandel erkämpft, um durch Verbilligung der
Rohstoffe und Arbeitslöhne seine Herrschaft auf dem Weltmarkt fester begründen
zu können.",Kapital,kapital
1900-01a,15939,2159289,"Sein berühmt gewordenes Eisenbahnbeispiel !
vortheilhafter sei, mit dem theureren Schnellzug, statt mit dem billigeren Bummel¬
zug zu fahren, so auch, theurere Waarenpreise zu bezahlen, um eine raschere
Entwicklung der Industrie zu erzielen — ist die Gegenüberstellung der „Produktiv¬
kräfte"" den „Tauschwerthen“ Auchgist er sich, abgesehen schon von dem kapita¬
listischen Charakter der Schutzzölle, vor Allem ihres relativen Werthes für
das Kapital selbst bewußt.",Kapital | Das Kapital,kapital | der kapital
1900-01a,15981,2165584,"Zu einer eingehenden Untersuchung der kapita¬
listischen Handelspolitik fehlte auch noch jener wissenschaftliche Bau, den Mary¬
später in seinem „Kapital"" errichtete.",Kapital,kapital
1900-01a,15983,2165962,"Engels konnte sich 1888 schon auf die zwei ersten
Bände des „Kapital"" und noch vieles Andere stützen, doch fehlie der dritte,
Band mit seinen wichtigen Untersuchungen über die Profitbildung, die Grund¬
rente und den Preis, die für die Lehre von der Konkurrenz und damit auch für
die Beurtheilung der Handelspolitik unentbehrlich sind.",Kapital | Das Kapital | Erste Band das Kapital,kapital | der kapital | erst band der kapital
1900-01a,16011,2170513,"588.
Welt vom Akkumulationsprozeß des Kapitals abhängig macht, zugleich
diesem unterwirft.",Kapital | Das Kapital,kapital | der kapital
1900-01a,16028,2172492,"Daß diese nicht immer zusammenfallen, daß das Interesse des Kapitals der
Produktionsentwicklung hinderlich sein kann, sieht er nicht mehr.",Kapital | Das Kapital,kapital | der kapital
1900-01a,16049,2175358,"Setne Kritik trifft den revolutionären Sozia¬
lismus nicht, der die Welteroberungspläne des Kapitals längst erkannt und
durch noch kühnere der Umgestaltung der kapitalistischen Welt übertrumpft
weshalb er denn dem Philister als unmögliche Utopie vorkommt.",Kapital | Das Kapital,kapital | der kapital
1900-01a,16300,2215343,"Die Arbeit ist der Mitarbeiter des Kapitals, aber ein Mit¬
arbeiter, der ohne Ungerechtigkeit und ohne Unklugheit nicht als unmündig behandelt.
werden darf.",Kapital | Das Kapital,kapital | der kapital
1900-01a,16601,2268807,"Ihr Zweck
ist nicht, die aufkeimende Entwicklung eines tiationalen Kapitals zu schützen, viel¬
mehr sind sie der unfehlbare Anzeiger, daß ein Land kapitalistisch weiter fort¬
geschritten ist, als seine Umgebung, aber auch, daß eine Hypertrophie, ein Ueber¬
maß der nationalen Entwicklung stattgefunden hat.",Kapital,kapital
1900-01a,16663,2278966,"Der Verlust an Leben und Lebenskraft, den das für die deutsche Arbeiterklasse,
bedeutet, wird freilich auf dem Geschäftskonto des vaterländischen Kapitals nicht
gebucht.",Kapital,kapital
1900-01a,16697,2284578,"Gewiß
sind die Industriezölle nicht blos als Vergeltungsmaßregeln aufzufassen — in¬
wiefern sie der Entwicklung des nationalen Kapitals entspringen, soll an anderer
Stelle erörtert werdett
aber durch die geschilderten Wirkungen der Agrarzölle,
wird diese handelspolitische Entwicklung beschleunigt und verschärft, und schließlich
spitzt sich thatsächlich das Verhältniß auf den offenen Kampf „Industriezölle gegen¬
Agrarzölle"" zu und die Handelspolitik wird aus einem Mittel zur Förderung der
Produktionsentwicklung auf beiden Seiten zu einem Mittel ihrer Hemmung.",Kapital,kapital
1900-01a,16866,2315189,"Und war jene ein Messer, miit dem man dem,
Arbeiter an die Gurgel wollte, so ist diese eine Waffe, mit der der wirthschaft¬
lichen Allmacht des Kapitals der Garaus gemacht wird.",Kapital | Das Kapital,kapital | der kapital
1900-01a,16871,2315762,"Die tödtliche Waffe gegen das Kapital wird also dem
Kapitalisten in den Schrank gelegt.",Kapital | Das Kapital,kapital | der kapital
1900-01a,16924,2325597,"Das Amnestiegesetz war die
juristische Entladung des Konfliktes zwischen der Zivilgesellschaft und der stehenden
Armee, das Assoziationsgesetz ist ein Versuch, den Widerstreit zwischen der Republik,
und der Kirche zu vertuschen, die Sozialreformen sind die juristische Aufhebung¬
des Kampfes zwischen Kapital und Arbeit.",Kapital,kapital
1900-01a,16933,2328115,"629
Ausdruck in der gleichzeitigen Ausarbeitung papierener Beglückungsmaßregeln für
Arbeiter und der Beschirmung des Kapitals mit der eisernen Realität des Bajonetts.",Kapital | Das Kapital,kapital | der kapital
1900-01a,16946,2330309,"Denn auch ein sozialistischer Minister ist,
solange er im bürgerlichen Ministerium figurirt, das heißt solange nicht Interessen
der Arbeiterklasse, sondern die des Kapitals im Staate herrschen, an die Zustim¬
mung der bürgerlichen Majorität der Regierung und der Volksvertretung gebunden.",Kapital | Das Kapital,kapital | der kapital
1900-01a,17400,2403527,Massenhaft häuft sich verwerthungsbegieriges Kapital.,Kapital,kapital
1900-01a,17408,2404884,"Aber
dort besteht ein Mangel an mobilem Kapital?",Kapital,kapital
1900-01a,17410,2404994,"Durch Untergrabung des lokalen Absatzmarktes
„arbeitslos"" geworden, wandern große Mengen Kapital aus den nördlichen nach.
den füdlichen Staaten aus.",Kapital,kapital
1900-01a,17503,2422485,"Endlich hat unsere Industrie¬
mit ihren kolossal entwickelten Prodnktivkräften jenen Punkt erreicht, wo der
Antheil, den Amerika vom Markte der zivilisirten Länder erlangen kann, bei
Weitem nicht mehr hinreicht, um für die angelegten Kapitalien die übliche Zins¬
rate abzuwerfen.",Kapital,kapital
1900-01a,18004,2500155,"Diese genaue Wiedergabe dessen, was Genosse Dreesbach wirklich gesagt hat,
verdirbt den bürgerlichen Blättern, die in ihrem Sinne politisches Kapital aus
seinen Ausführungen zu schlagen versuchen, einigermaßen den Spaß;",Kapital,kapital
1900-01a,18053,2509329,"Heute freilich¬
haben die Ultramontanen dies Präsidium in der Hand, um einfach nach der
Pfeife der Regierung zu tanzen und politisch nur noch von dem Kapital zu
zehren, das sie sich als parlamentarische Partapartei erworben haben.",Kapital | Das Kapital,kapital | der kapital
1900-01a,18833,2633117,"Die wichtigsten Bedingungen der industriellen Entwicklung eines Landes sind:
Eisenbahnen, Städte, Telegraphen und Posten, Organisation des Handels, An¬
häufung von Kapital, Entwicklung eines Geldmarktes, leistungsfähige und geschulte
Fabrikarbeiter, Volksschulen, technische Schulen, parlamentarische Verfassung.",Kapital,kapital
1900-01a,18855,2636408,"Es ist von Marx im dritten Bande
seines „Kapital"" gezeigt worden, wie mit der Kapitalakkumulation die Profit¬
rate sinken muß, weil das konstante Kapital immer größer wird im Vergleich¬
zu dem variablen, Mehrwerth bildenden Theile des Kapitals.",Kapital | Das Kapital,kapital | der kapital
1900-01a,18866,2637704,"Kapital aber ist in Europa,
ihnen folgenden Handelsverkehr diese Rentabilität erst
in Massen aufgehäuft, die Industrie sucht mit Gewalt nach einem Absatz, und die Eisen¬
europäische Eisenbahnnetz nicht mehr:
industrie gerade deshalb, weil das bereits ausgebaute
in dem gleichen Tempo sich weiter entwickeln kannt.",Kapital,kapital
1900-01a,18890,2641478,"daß das englische Kapital seitdem den ganzen Erdball¬
zum Schauplatz seiner Ausbeutung gemacht hat, daß es ebenso an der Zersetzung des „gol¬
denen Bodens“ im deutschen Handwerk wie an der Untergrabung des „Mir“ der russischen
Gemeinde mitgewirkt, daß es ganze Völkerschaften ausgerottet und Volksmassen über den
Ozean geworfen hat, das sehen sie in dem Maulwurfsloch ihrer Profesforenklause nicht;",Kapital,kapital
1900-01a,18891,2641877,"sie
sehen nicht einmal die Massengräber, welche dieses englische Kapital vor ihren Augen in
Ostindien aufrichtet.",Kapital,kapital
1900-01a,18892,2641991,"In den kapitalistischen Ansiadlungsgebieten, in denen die vom Kapital aus
Europa ausgestoßenen Arbeitermassen erst eine Produktion und eine Wirthschaftsordnung
schaffen, sind die Löhne höher als in Eurøpa;",Kapital | Das Kapital,kapital | der kapital
1900-01a,18893,2642197,"da aber die Mehrwerthsrate dort nicht
niedriger sein kann, sondern ebenfalls höher sein muß, um enropäisches Kapital heranzu¬
locken, so dient das zunächst als Hinderniß der Entwicklung der Industrie.",Kapital,kapital
1900-01a,18915,2645913,"Da
er wenig Kredit hat, kann er wenig Kredit gebent er muß peinlich dafür forgen,
Einkauf, Produktion, Verkauf und
daß der Umschlagszyklus seines Kapitals
er muß einen Geldvorrath haben,
Rückfluß des Geldes — nicht verzögert werde.",Kapital,kapital
1900-01a,18922,2647062,"des Kapitals beginnt, eine andere quantitative Zusammenfetzung hat, als WI,
oder
im Falle einer Ueberproduktion — quantitativ geringer ist als W1,
kann der Kredit, der nur an Stelle des harten Metalls dessen Buchwerth setzt,
nichts helfen;",Kapital | Das Kapital,kapital | der kapital
1900-01a,18923,2647302,"aber der Kredit durchbricht die Schranken des Privateigen¬
thums für die Einzelunternehmung, er vereinigt das Privateigenthum Einzelner,
zum gesellschaftlichen Privateigenthum einer Klasse, er schafft erst das natio¬
nale Kapital.",Kapital,kapital
1900-01a,18924,2647533,"Ein wichtiges Moment der Konkurrenzfähigkeit des Kapitals ist nach eigenem
Zugeständniß der Fabrikanten die Letstungsfähigkeit der Arbeiter.",Kapital | Das Kapital,kapital | der kapital
1900-01a,18931,2648561,"Denken wir uns eine Fabrik I, deren Kapital so zusammengesetzt ist:
350000 Mark.",Kapital | Das Kapital,kapital | der kapital
1900-01a,18944,2649309,An Kapital mag auch gespart werden.,Kapital,kapital
1900-01a,18947,2649613,"zu gleicher Zeit bedingt er eine Scheidung in der sozialen
Stellung der Besitzer der Produktionsmittel: als Unternehmer werden sie zu Funktio¬
nären, zu Geschäftsagenten des unpersönlichen Kapitals, als Kapitalisten werden sie pure¬
Rentenbezieher.",Kapital,kapital
1900-01a,18950,2650127,"Das gesammte investirte Kapital wird also hier 1 350000 Mark¬
betragen.",Kapital,kapital
